Const,Your Rating,Date Rated,Title,URL,Title Type,IMDb Rating,Runtime (mins),Year,Genres,Num Votes,Release Date,Directors
tt13977196,6,2021-12-16,"The Flash: Armageddon, Part 1",https://www.imdb.com/title/tt13977196/,tvEpisode,7.2,42,2021,"Action, Adventure, Drama, Sci-Fi",1651,2021-11-16,Eric Dean Seaton
tt13977218,7,2022-04-14,Riverdale: Chapter Ninety-Six: Welcome to Rivervale,https://www.imdb.com/title/tt13977218/,tvEpisode,5.0,42,2021,"Crime, Drama, Mystery, Romance",941,2021-11-16,Gabriel Correa
tt13977604,5,2021-12-16,"The Flash: Armageddon, Part 2",https://www.imdb.com/title/tt13977604/,tvEpisode,7.7,42,2021,"Action, Adventure, Drama, Sci-Fi",1543,2021-11-23,Menhaj Huda
tt13977630,7,2022-04-14,Riverdale: Chapter Ninety-Seven: Ghost Stories,https://www.imdb.com/title/tt13977630/,tvEpisode,4.9,42,2021,"Crime, Drama, Mystery, Romance",755,2021-11-23,Gabriel Correa
tt1399103,2,2022-09-19,Transformers: Dark of the Moon,https://www.imdb.com/title/tt1399103/,movie,6.2,154,2011,"Action, Adventure, Sci-Fi",415915,2011-06-23,Michael Bay
tt14077386,9,2022-11-27,Wednesday: Wednesday's Child Is Full of Woe,https://www.imdb.com/title/tt14077386/,tvEpisode,7.9,57,2022,"Comedy, Crime, Fantasy, Mystery",9964,2022-10-31,Tim Burton
tt14077394,7,2022-11-27,Wednesday: Woe Is the Loneliest Number,https://www.imdb.com/title/tt14077394/,tvEpisode,7.8,47,2022,"Comedy, Crime, Fantasy, Mystery",8305,2022-11-23,Tim Burton
tt14077396,5,2022-11-27,Wednesday: Friend or Woe,https://www.imdb.com/title/tt14077396/,tvEpisode,7.9,45,2022,"Comedy, Crime, Fantasy, Mystery",7992,2022-11-23,Tim Burton
tt14077400,4,2022-11-27,Wednesday: Woe What a Night,https://www.imdb.com/title/tt14077400/,tvEpisode,8.3,48,2022,"Comedy, Crime, Fantasy, Mystery",7977,2022-11-23,Tim Burton
tt14077402,8,2022-11-27,Wednesday: You Reap What You Woe,https://www.imdb.com/title/tt14077402/,tvEpisode,7.8,50,2022,"Comedy, Crime, Fantasy, Mystery",7326,2022-11-23,Gandja Monteiro
tt1409024,6,2023-01-29,Men in Black 3,https://www.imdb.com/title/tt1409024/,movie,6.8,106,2012,"Action, Adventure, Comedy, Sci-Fi",370831,2012-05-14,Barry Sonnenfeld
tt1411697,1,2021-06-16,The Hangover Part II,https://www.imdb.com/title/tt1411697/,movie,6.5,102,2011,Comedy,510966,2011-05-19,Todd Phillips
tt14146694,1,2021-08-19,Riverdale: Chapter Eighty-Seven: Strange Bedfellows,https://www.imdb.com/title/tt14146694/,tvEpisode,6.0,42,2021,"Crime, Drama, Mystery, Romance",704,2021-08-11,Tessa Blake
tt14203072,4,2021-12-20,The Grand Tour: The Grand Tour Presents: Lochdown,https://www.imdb.com/title/tt14203072/,tvEpisode,7.8,,2021,"Comedy, Sport, Talk-Show",2424,2021-07-30,Phil Churchward
tt14257844,1,2021-07-24,"The Flash: Heart of the Matter, Part 2",https://www.imdb.com/title/tt14257844/,tvEpisode,7.0,42,2021,"Action, Adventure, Drama, Sci-Fi",1611,2021-07-20,Marcus Stokes
tt14270746,7,2021-07-24,The Flash: The One with the Nineties,https://www.imdb.com/title/tt14270746/,tvEpisode,6.5,42,2021,"Action, Adventure, Drama, Sci-Fi",1714,2021-04-06,Jeffrey W. Byrd
tt14270750,1,2021-07-24,The Flash: Growing Pains,https://www.imdb.com/title/tt14270750/,tvEpisode,6.8,42,2021,"Action, Adventure, Drama, Sci-Fi",1530,2021-04-13,Alexandra La Roche
tt14270760,3,2021-07-24,The Flash: The People V. Killer Frost,https://www.imdb.com/title/tt14270760/,tvEpisode,7.2,42,2021,"Action, Adventure, Drama, Sci-Fi",1651,2021-05-04,Sudz Sutherland
tt14270764,3,2021-07-24,The Flash: Timeless,https://www.imdb.com/title/tt14270764/,tvEpisode,5.8,42,2021,"Action, Adventure, Drama, Sci-Fi",1557,2021-05-11,Menhaj Huda
tt14270768,4,2021-07-24,"The Flash: Family Matters, Part 1",https://www.imdb.com/title/tt14270768/,tvEpisode,5.9,42,2021,"Action, Adventure, Drama, Sci-Fi",1479,2021-05-18,Philip Chipera
tt14270780,3,2021-07-24,"The Flash: Family Matters, Part 2",https://www.imdb.com/title/tt14270780/,tvEpisode,5.7,42,2021,"Action, Adventure, Drama, Sci-Fi",1571,2021-05-25,Chad Lowe
tt14270786,5,2021-07-24,The Flash: Good-Bye Vibrations,https://www.imdb.com/title/tt14270786/,tvEpisode,7.0,42,2021,"Action, Adventure, Drama, Sci-Fi",1481,2021-06-08,Philip Chipera
tt14270788,2,2021-07-24,The Flash: Masquerade,https://www.imdb.com/title/tt14270788/,tvEpisode,6.1,42,2021,"Action, Adventure, Drama, Sci-Fi",1350,2021-06-15,Rachel Talalay
tt14270790,6,2021-07-24,The Flash: Rayo de Luz,https://www.imdb.com/title/tt14270790/,tvEpisode,4.8,42,2021,"Action, Adventure, Drama, Sci-Fi",1618,2021-06-22,Danielle Panabaker
tt14270794,5,2021-07-24,The Flash: Enemy at the Gates,https://www.imdb.com/title/tt14270794/,tvEpisode,7.1,42,2021,"Action, Adventure, Drama, Sci-Fi",1369,2021-06-29,Geoffrey Wing Shotz
tt14270798,3,2021-07-24,The Flash: P.O.W.,https://www.imdb.com/title/tt14270798/,tvEpisode,7.2,42,2021,"Action, Adventure, Drama, Sci-Fi",1314,2021-07-06,Marcus Stokes
tt14270804,1,2021-07-24,"The Flash: Heart of the Matter, Part 1",https://www.imdb.com/title/tt14270804/,tvEpisode,7.3,42,2021,"Action, Adventure, Drama, Sci-Fi",1395,2021-07-13,Eric Dean Seaton
tt14271400,7,2022-03-22,Naomi: Don't Believe Everything You Think,https://www.imdb.com/title/tt14271400/,tvEpisode,5.8,,2022,"Action, Adventure, Drama, Sci-Fi",495,2022-01-11,Amanda Marsalis
tt14272186,8,2022-03-21,Doom Patrol: Dead Patrol,https://www.imdb.com/title/tt14272186/,tvEpisode,8.3,,2021,"Action, Adventure, Comedy, Drama, Mystery, Sci-Fi",1143,2021-09-23,Chris Manley
tt14272190,8,2022-03-21,Doom Patrol: Vacay Patrol,https://www.imdb.com/title/tt14272190/,tvEpisode,8.2,,2021,"Action, Adventure, Comedy, Drama, Mystery, Sci-Fi",1082,2021-09-23,Chris Manley
tt1431045,7,2022-04-29,Deadpool,https://www.imdb.com/title/tt1431045/,movie,8.0,108,2016,"Action, Comedy",1059095,2016-01-21,Tim Miller
tt1440129,3,2022-09-19,Battleship,https://www.imdb.com/title/tt1440129/,movie,5.8,131,2012,"Action, Adventure, Sci-Fi, Thriller",251328,2012-04-03,Peter Berg
tt14536106,8,2021-08-06,"Love, Death & Robots: Ice",https://www.imdb.com/title/tt14536106/,tvEpisode,6.1,13,2021,"Animation, Short, Action, Adventure, Comedy, Drama, Fantasy, Horror, Mystery, Sci-Fi, Thriller",10932,2021-05-14,"Robert Valley, Jennifer Yuh Nelson"
tt14536130,9,2022-04-28,"Love, Death & Robots: Automated Customer Service",https://www.imdb.com/title/tt14536130/,tvEpisode,6.5,12,2021,"Animation, Short, Action, Adventure, Comedy, Drama, Fantasy, Horror, Mystery, Sci-Fi, Thriller",11612,2021-05-14,"Meat Dept, Jennifer Yuh Nelson"
tt14536160,4,2021-08-06,"Love, Death & Robots: Snow in the Desert",https://www.imdb.com/title/tt14536160/,tvEpisode,7.8,18,2021,"Animation, Short, Action, Adventure, Comedy, Drama, Fantasy, Horror, Mystery, Sci-Fi, Thriller",11410,2021-05-14,"Jennifer Yuh Nelson, Maxime Luère, Dominique Boidin, Léon Bérelle, Rémi Kozyra"
tt14539550,6,2022-03-21,Doom Patrol: Undead Patrol,https://www.imdb.com/title/tt14539550/,tvEpisode,7.9,,2021,"Action, Adventure, Comedy, Drama, Mystery, Sci-Fi",969,2021-09-30,Kristin Windell
tt14539552,7,2022-03-21,Doom Patrol: Dada Patrol,https://www.imdb.com/title/tt14539552/,tvEpisode,7.2,,2021,"Action, Adventure, Comedy, Drama, Mystery, Sci-Fi",894,2021-10-07,Kristin Windell
tt14539554,6,2022-03-21,Doom Patrol: 1917 Patrol,https://www.imdb.com/title/tt14539554/,tvEpisode,7.2,,2021,"Action, Adventure, Comedy, Drama, Mystery, Sci-Fi",844,2021-10-14,Omar Madha
tt14539556,6,2022-03-21,Doom Patrol: Bird Patrol,https://www.imdb.com/title/tt14539556/,tvEpisode,7.3,,2021,"Action, Adventure, Comedy, Drama, Mystery, Sci-Fi",802,2021-10-21,Omar Madha
tt14539560,9,2022-03-21,Doom Patrol: Amends Patrol,https://www.imdb.com/title/tt14539560/,tvEpisode,7.8,,2021,"Action, Adventure, Comedy, Drama, Mystery, Sci-Fi",731,2021-11-11,Harry Jierjian
tt14539562,8,2022-03-21,Doom Patrol: Subconscious Patrol,https://www.imdb.com/title/tt14539562/,tvEpisode,8.0,,2021,"Action, Adventure, Comedy, Drama, Mystery, Sci-Fi",906,2021-10-28,Rebecca Rodriguez
tt14539564,7,2022-03-21,Doom Patrol: Evil Patrol,https://www.imdb.com/title/tt14539564/,tvEpisode,7.6,,2021,"Action, Adventure, Comedy, Drama, Mystery, Sci-Fi",762,2021-11-04,Rebecca Rodriguez
tt14544192,8,2023-02-28,Bo Burnham: Inside,https://www.imdb.com/title/tt14544192/,tvSpecial,8.6,87,2021,"Comedy, Drama, Music",50875,2021-05-30,Bo Burnham
tt1457767,9,2021-07-31,The Conjuring,https://www.imdb.com/title/tt1457767/,movie,7.5,112,2013,"Horror, Mystery, Thriller",520790,2013-06-08,James Wan
tt14586040,7,2022-05-22,Arcane: League of Legends: Welcome to the Playground,https://www.imdb.com/title/tt14586040/,tvEpisode,8.5,43,2021,"Animation, Action, Adventure, Drama, Fantasy, Sci-Fi",14655,2021-11-06,"Pascal Charrue, Arnaud Delord"
tt14668686,10,2022-11-02,The Owl House: Thanks to Them,https://www.imdb.com/title/tt14668686/,tvEpisode,9.4,47,2022,"Animation, Action, Adventure, Comedy, Drama, Family, Fantasy, Horror, Mystery",1071,2022-10-15,"Amelia Lorenz, Bosook Coburn"
tt14677076,5,2021-12-16,"The Flash: Armageddon, Part 3",https://www.imdb.com/title/tt14677076/,tvEpisode,7.6,42,2021,"Action, Adventure, Drama, Sci-Fi",1401,2021-11-30,Chris Peppe
tt14677082,5,2021-12-16,"The Flash: Armageddon, Part 4",https://www.imdb.com/title/tt14677082/,tvEpisode,7.8,42,2021,"Action, Adventure, Drama, Sci-Fi",1479,2021-12-07,Chad Lowe
tt14677086,8,2021-12-16,"The Flash: Armageddon, Part 5",https://www.imdb.com/title/tt14677086/,tvEpisode,7.0,42,2021,"Action, Adventure, Drama, Sci-Fi",1301,2021-12-14,Menhaj Huda
tt1469304,5,2021-05-31,Baywatch,https://www.imdb.com/title/tt1469304/,movie,5.5,116,2017,"Action, Comedy, Crime",192059,2017-05-12,Seth Gordon
tt14725776,9,2021-09-05,Generation: Absolute Zero,https://www.imdb.com/title/tt14725776/,tvEpisode,7.7,,2021,"Comedy, Drama",223,2021-06-17,Andrew Ahn
tt14725780,7,2021-09-05,Generation: The High Priestess,https://www.imdb.com/title/tt14725780/,tvEpisode,6.9,,2021,"Comedy, Drama",212,2021-06-24,Andrew Ahn
tt14725786,9,2021-09-05,Generation: There's Something About Hamburger Mary's,https://www.imdb.com/title/tt14725786/,tvEpisode,7.9,,2021,"Comedy, Drama",216,2021-06-24,Anu Valia
tt14725788,9,2021-09-05,Generation: CLICK WHIRR,https://www.imdb.com/title/tt14725788/,tvEpisode,7.9,,2021,"Comedy, Drama",207,2021-07-01,Anu Valia
tt14725792,10,2021-09-05,Generation: L'Amour,https://www.imdb.com/title/tt14725792/,tvEpisode,8.1,,2021,"Comedy, Drama",191,2021-07-01,Daniel Barnz
tt14725794,10,2021-09-06,Generation: V-Day,https://www.imdb.com/title/tt14725794/,tvEpisode,8.5,39,2021,"Comedy, Drama",214,2021-07-08,Daniel Barnz
tt1477834,9,2022-03-21,Aquaman,https://www.imdb.com/title/tt1477834/,movie,6.8,143,2018,"Action, Adventure, Fantasy, Sci-Fi",486888,2018-11-26,James Wan
tt14787320,3,2021-09-05,Riverdale: Chapter Eighty-Nine: Reservoir Dogs,https://www.imdb.com/title/tt14787320/,tvEpisode,6.2,42,2021,"Crime, Drama, Mystery, Romance",611,2021-08-25,Gabriel Correa
tt14850292,8,2021-08-19,Riverdale: Chapter Eighty-Eight: Citizen Lodge,https://www.imdb.com/title/tt14850292/,tvEpisode,7.9,42,2021,"Crime, Drama, Mystery, Romance",871,2021-08-18,James DeWille
tt1486217,8,2023-02-28,Archer,https://www.imdb.com/title/tt1486217/,tvSeries,8.6,22,2009,"Animation, Action, Comedy",158312,2009-09-17,
tt14872296,8,2022-11-20,Inside Job: How Reagan Got Her Grove Back,https://www.imdb.com/title/tt14872296/,tvEpisode,7.4,,2022,"Animation, Comedy, Fantasy, Sci-Fi",598,2022-11-18,"David Ochs, Vitaliy Strokous"
tt14872298,6,2022-11-20,Inside Job: Reagan & Mychelle's Hive School Reunion,https://www.imdb.com/title/tt14872298/,tvEpisode,7.1,,2022,"Animation, Comedy, Fantasy, Sci-Fi",495,2022-11-18,"Vitaliy Strokous, Mollie Helms"
tt14872300,8,2022-11-20,Inside Job: Whoas-Feratu,https://www.imdb.com/title/tt14872300/,tvEpisode,7.6,,2022,"Animation, Comedy, Fantasy, Sci-Fi",539,2022-11-18,"Vitaliy Strokous, Mike Bertino"
tt14872302,9,2022-11-20,Inside Job: We Found Love in a Popeless Place,https://www.imdb.com/title/tt14872302/,tvEpisode,7.6,,2022,"Animation, Comedy, Fantasy, Sci-Fi",493,2022-11-18,"David Ochs, Vitaliy Strokous"
tt14872304,7,2022-11-20,Inside Job: Brettwork,https://www.imdb.com/title/tt14872304/,tvEpisode,7.7,,2022,"Animation, Comedy, Fantasy, Sci-Fi",481,2022-11-18,"Hannah Cho, Vitaly Podolyak"
tt14889190,5,2021-07-10,Rick and Morty: Mortyplicity,https://www.imdb.com/title/tt14889190/,tvEpisode,8.7,22,2021,"Animation, Adventure, Comedy, Sci-Fi",11995,2021-06-27,"Lucas Gray, Wesley Archer"
tt14889192,8,2021-07-06,Rick and Morty: A Rickconvenient Mort,https://www.imdb.com/title/tt14889192/,tvEpisode,7.8,22,2021,"Animation, Adventure, Comedy, Sci-Fi",11231,2021-07-04,"Juan Jose Meza-Leon, Wesley Archer"
tt14898020,4,2021-07-24,Rick and Morty: Rickdependence Spray,https://www.imdb.com/title/tt14898020/,tvEpisode,5.7,22,2021,"Animation, Adventure, Comedy, Sci-Fi",12965,2021-07-11,"Erica Hayes, Wesley Archer"
tt1489889,6,2022-04-29,Central Intelligence,https://www.imdb.com/title/tt1489889/,movie,6.3,107,2016,"Action, Comedy, Crime",198215,2016-06-10,Rawson Marshall Thurber
tt15000920,4,2021-07-23,Rick and Morty: Amortycan Grickfitti,https://www.imdb.com/title/tt15000920/,tvEpisode,7.0,22,2021,"Animation, Adventure, Comedy, Sci-Fi",8988,2021-07-18,"Wesley Archer, Kyoung Hee Lim"
tt15041140,6,2021-08-03,Rick and Morty: Rick & Morty's Thanksploitation Spectacular,https://www.imdb.com/title/tt15041140/,tvEpisode,7.1,23,2021,"Animation, Adventure, Comedy, Sci-Fi",8872,2021-07-25,"Douglas Einar Olsen, Wesley Archer"
tt15041146,10,2021-08-09,Rick and Morty: Rickternal Friendshine of the Spotless Mort,https://www.imdb.com/title/tt15041146/,tvEpisode,8.2,22,2021,"Animation, Adventure, Comedy, Sci-Fi",8703,2021-08-08,"Erica Hayes, Wesley Archer"
tt15041318,5,2021-08-03,Rick and Morty: Gotron Jerrysis Rickvangelion,https://www.imdb.com/title/tt15041318/,tvEpisode,6.4,23,2021,"Animation, Adventure, Comedy, Sci-Fi",8657,2021-08-01,"Wesley Archer, Jacob Hair"
tt15041328,8,2022-12-19,Rick and Morty: Forgetting Sarick Mortshall,https://www.imdb.com/title/tt15041328/,tvEpisode,8.3,21,2021,"Animation, Adventure, Comedy, Sci-Fi",7493,2021-09-05,"Wesley Archer, Kyoung Hee Lim"
tt15041334,8,2022-12-19,Rick and Morty: Rickmurai Jack,https://www.imdb.com/title/tt15041334/,tvEpisode,9.3,22,2021,"Animation, Adventure, Comedy, Sci-Fi",11901,2021-09-05,"Wesley Archer, Jacob Hair"
tt15054962,9,2022-11-27,Heartbreak High,https://www.imdb.com/title/tt15054962/,tvSeries,7.7,50,2022,"Drama, Romance",7928,2022-09-14,
tt15139794,7,2021-09-05,Riverdale: Chapter Ninety: The Night Gallery,https://www.imdb.com/title/tt15139794/,tvEpisode,6.5,42,2021,"Crime, Drama, Mystery, Romance",625,2021-09-01,Mädchen Amick
tt15223376,3,2021-09-18,Riverdale: Chapter Ninety-One: The Return of the Pussycats,https://www.imdb.com/title/tt15223376/,tvEpisode,4.3,44,2021,"Crime, Drama, Mystery, Romance",923,2021-09-08,Robin Givens
tt15318872,8,2022-12-25,Werewolf by Night,https://www.imdb.com/title/tt15318872/,tvSpecial,7.2,52,2022,"Action, Adventure, Drama, Fantasy, Horror, Mystery, Thriller",60195,2022-09-25,Michael Giacchino
tt15332182,7,2022-03-22,Naomi: Unidentified Flying Object,https://www.imdb.com/title/tt15332182/,tvEpisode,6.1,,2022,"Action, Adventure, Drama, Sci-Fi",317,2022-01-18,DeMane Davis
tt15387948,8,2022-04-28,What If...?: What If... Ultron Won?,https://www.imdb.com/title/tt15387948/,tvEpisode,9.0,28,2021,"Animation, Action, Adventure, Sci-Fi",14310,2021-09-29,Bryan Andrews
tt15389382,5,2022-12-19,Rick and Morty: Bethic Twinstinct,https://www.imdb.com/title/tt15389382/,tvEpisode,7.8,22,2022,"Animation, Adventure, Comedy, Sci-Fi",6409,2022-09-18,"Douglas Einar Olsen, Wesley Archer"
tt15496376,9,2022-05-22,Arcane: League of Legends: The Base Violence Necessary for Change,https://www.imdb.com/title/tt15496376/,tvEpisode,9.6,44,2021,"Animation, Action, Adventure, Drama, Fantasy, Sci-Fi",18706,2021-11-06,"Pascal Charrue, Arnaud Delord"
tt15496380,8,2022-05-22,Arcane: League of Legends: Some Mysteries Are Better Left Unsolved,https://www.imdb.com/title/tt15496380/,tvEpisode,8.5,41,2021,"Animation, Action, Adventure, Drama, Fantasy, Sci-Fi",13235,2021-11-06,"Pascal Charrue, Arnaud Delord"
tt15496390,9,2022-05-22,Arcane: League of Legends: Happy Progress Day!,https://www.imdb.com/title/tt15496390/,tvEpisode,8.7,40,2021,"Animation, Action, Adventure, Drama, Fantasy, Sci-Fi",11964,2021-11-13,"Pascal Charrue, Arnaud Delord"
tt15496392,9,2022-05-22,Arcane: League of Legends: Everybody Wants to Be My Enemy,https://www.imdb.com/title/tt15496392/,tvEpisode,8.9,40,2021,"Animation, Action, Adventure, Drama, Fantasy, Sci-Fi",11832,2021-11-13,"Pascal Charrue, Arnaud Delord"
tt15496430,9,2022-05-22,Arcane: League of Legends: When These Walls Come Tumbling Down,https://www.imdb.com/title/tt15496430/,tvEpisode,9.2,42,2021,"Animation, Action, Adventure, Drama, Fantasy, Sci-Fi",12476,2021-11-13,"Pascal Charrue, Arnaud Delord"
tt15496436,10,2022-05-22,Arcane: League of Legends: The Boy Savior,https://www.imdb.com/title/tt15496436/,tvEpisode,9.2,40,2021,"Animation, Action, Adventure, Drama, Fantasy, Sci-Fi",11901,2021-11-20,"Pascal Charrue, Arnaud Delord"
tt15519898,4,2022-03-22,Naomi: Zero to Sixty,https://www.imdb.com/title/tt15519898/,tvEpisode,6.3,,2022,"Action, Adventure, Drama, Sci-Fi",265,2022-01-25,Sheldon Candis
tt15572586,5,2022-04-14,Riverdale: Chapter Ninety-Nine: The Witching Hour(s),https://www.imdb.com/title/tt15572586/,tvEpisode,5.6,42,2021,"Crime, Drama, Mystery, Romance",755,2021-12-07,James DeWille
tt15747050,7,2022-04-14,Riverdale: Chapter Ninety-Eight: Mr. Cypher,https://www.imdb.com/title/tt15747050/,tvEpisode,5.0,42,2021,"Crime, Drama, Mystery, Romance",660,2021-11-30,Jeff Woolnough
tt15747054,8,2022-04-14,Riverdale: Chapter One Hundred: The Jughead Paradox,https://www.imdb.com/title/tt15747054/,tvEpisode,7.4,42,2021,"Crime, Drama, Mystery, Romance",782,2021-12-14,Gabriel Correa
tt1583421,4,2022-12-25,G.I. Joe: Retaliation,https://www.imdb.com/title/tt1583421/,movie,5.7,110,2013,"Action, Adventure, Sci-Fi, Thriller",183784,2013-03-11,Jon M. Chu
tt1591786,10,2023-03-29,Doctor Who: Vincent and the Doctor,https://www.imdb.com/title/tt1591786/,tvEpisode,9.3,47,2010,"Adventure, Drama, Sci-Fi",11541,2010-06-05,Jonny Campbell
tt1596343,5,2022-04-29,Fast Five,https://www.imdb.com/title/tt1596343/,movie,7.3,130,2011,"Action, Crime, Thriller",388183,2011-04-15,Justin Lin
tt16246416,1,2021-12-20,The Grand Tour: The Grand Tour Presents: Carnage A Trois,https://www.imdb.com/title/tt16246416/,tvEpisode,7.9,68,2021,"Comedy, Sport, Talk-Show",2338,2021-12-17,
tt1630029,8,2023-01-19,Avatar: The Way of Water,https://www.imdb.com/title/tt1630029/,movie,7.7,192,2022,"Action, Adventure, Fantasy, Sci-Fi",349677,2022-12-06,James Cameron
tt1632701,3,2022-12-19,Suits,https://www.imdb.com/title/tt1632701/,tvSeries,8.5,44,2011,"Comedy, Drama",421482,2011-06-23,
tt1638355,8,2022-04-14,The Man from U.N.C.L.E.,https://www.imdb.com/title/tt1638355/,movie,7.2,116,2015,"Action, Adventure, Comedy",317702,2015-08-02,Guy Ritchie
tt16428536,4,2022-04-14,Riverdale: Chapter One Hundred and One: Unbelievable,https://www.imdb.com/title/tt16428536/,tvEpisode,5.9,42,2022,"Crime, Drama, Mystery, Romance",527,2022-03-20,James DeWille
tt1649418,6,2022-09-19,The Gray Man,https://www.imdb.com/title/tt1649418/,movie,6.5,122,2022,"Action, Thriller",212848,2022-07-13,"Anthony Russo, Joe Russo"
tt1663662,8,2022-04-28,Pacific Rim,https://www.imdb.com/title/tt1663662/,movie,6.9,131,2013,"Action, Adventure, Sci-Fi",510574,2013-07-01,Guillermo del Toro
tt1670345,5,2021-06-16,Now You See Me,https://www.imdb.com/title/tt1670345/,movie,7.2,115,2013,"Crime, Mystery, Thriller",674174,2013-05-21,Louis Leterrier
tt1677720,4,2022-04-29,Ready Player One,https://www.imdb.com/title/tt1677720/,movie,7.4,140,2018,"Action, Adventure, Sci-Fi",449224,2018-03-11,Steven Spielberg
tt16867040,9,2023-01-31,Cunk on Earth,https://www.imdb.com/title/tt16867040/,tvSeries,8.1,29,2022,Comedy,14937,2022-09-19,
tt1695360,3,2023-01-31,The Legend of Korra,https://www.imdb.com/title/tt1695360/,tvSeries,8.4,23,2012,"Animation, Action, Adventure, Comedy, Drama, Family, Fantasy, Sci-Fi",125895,2012-04-14,
tt1700841,1,2023-02-28,Sausage Party,https://www.imdb.com/title/tt1700841/,movie,6.1,89,2016,"Animation, Adventure, Comedy, Fantasy",199741,2016-03-14,"Conrad Vernon, Greg Tiernan"
tt1745960,9,2022-08-28,Top Gun: Maverick,https://www.imdb.com/title/tt1745960/,movie,8.3,130,2022,"Action, Drama",566517,2022-05-18,Joseph Kosinski
tt1751634,10,2022-08-18,The Sandman,https://www.imdb.com/title/tt1751634/,tvSeries,7.7,45,2022,"Drama, Fantasy, Horror, Mystery, Sci-Fi",154837,2022-08-05,
tt1773185,10,2022-11-29,Mahô shôjo Madoka magika: Puella Magi Madoka Magica,https://www.imdb.com/title/tt1773185/,tvMiniSeries,8.2,24,2011,"Animation, Drama, Fantasy, Horror, Mystery, Thriller",10283,2011-01-07,
tt1781781,7,2022-12-27,Born to Race,https://www.imdb.com/title/tt1781781/,video,5.9,99,2011,"Action, Sport",6539,2011-10-06,Alex Ranarivelo
tt1790809,4,2023-01-29,Pirates of the Caribbean: Dead Men Tell No Tales,https://www.imdb.com/title/tt1790809/,movie,6.5,129,2017,"Action, Adventure, Fantasy",321502,2017-05-11,"Espen Sandberg, Joachim Rønning"
tt1790864,3,2023-01-29,The Maze Runner,https://www.imdb.com/title/tt1790864/,movie,6.8,113,2014,"Action, Mystery, Sci-Fi, Thriller",480079,2014-09-11,Wes Ball
tt1840309,2,2022-04-29,Divergent,https://www.imdb.com/title/tt1840309/,movie,6.6,139,2014,"Action, Adventure, Mystery, Sci-Fi",469288,2014-03-18,Neil Burger
tt18558682,2,2022-04-14,Riverdale: Chapter One Hundred and Two: Death at a Funeral,https://www.imdb.com/title/tt18558682/,tvEpisode,6.0,42,2022,"Crime, Drama, Mystery, Romance",457,2022-03-27,Tara Dafoe
tt1865718,9,2022-08-28,Gravity Falls,https://www.imdb.com/title/tt1865718/,tvSeries,8.9,23,2012,"Animation, Adventure, Comedy, Family, Fantasy",116226,2012-06-14,
tt1869454,9,2023-01-16,Good Omens,https://www.imdb.com/title/tt1869454/,tvSeries,8.0,328,2019,"Comedy, Fantasy",81558,2019-05-27,
tt0187078,7,2023-01-02,Gone in Sixty Seconds,https://www.imdb.com/title/tt0187078/,movie,6.5,118,2000,"Action, Crime, Thriller",284254,2000-06-05,Dominic Sena
tt1877830,9,2022-03-20,The Batman,https://www.imdb.com/title/tt1877830/,movie,7.8,176,2022,"Action, Crime, Drama, Thriller",690110,2022-03-01,Matt Reeves
tt1877832,8,2022-04-29,X-Men: Days of Future Past,https://www.imdb.com/title/tt1877832/,movie,7.9,132,2014,"Action, Adventure, Sci-Fi, Thriller",721944,2014-05-10,Bryan Singer
tt18884448,3,2022-04-14,Riverdale: Chapter One Hundred and Three: The Town,https://www.imdb.com/title/tt18884448/,tvEpisode,6.0,42,2022,"Crime, Drama, Mystery, Romance",440,2022-04-03,Rob Seidenglanz
tt18967140,8,2023-02-20,The Flash: Wednesday Ever After,https://www.imdb.com/title/tt18967140/,tvEpisode,7.0,,2023,"Action, Adventure, Drama, Sci-Fi",1066,2023-02-08,Vanessa Parise
tt18967158,3,2023-03-30,Riverdale: Chapter One Hundred Eighteen: Don't Worry Darling,https://www.imdb.com/title/tt18967158/,tvEpisode,7.0,43,2023,"Crime, Drama, Mystery, Romance",240,2023-03-29,Ronald Paul Richard
tt1898069,9,2023-02-11,American Gods,https://www.imdb.com/title/tt1898069/,tvSeries,7.6,60,2017,"Drama, Fantasy, Mystery",88763,2017-03-01,
tt19048504,2,2022-05-01,Riverdale: Chapter One Hundred and Four: The Serpent Queen's Gambit,https://www.imdb.com/title/tt19048504/,tvEpisode,6.3,42,2022,"Crime, Drama, Mystery, Romance",434,2022-04-10,Antonio Negret
tt1905041,7,2022-04-29,Furious 6,https://www.imdb.com/title/tt1905041/,movie,7.0,130,2013,"Action, Adventure, Crime, Thriller",400726,2013-05-07,Justin Lin
tt19296606,1,2022-05-01,Riverdale: Chapter One Hundred and Five: Folk Heroes,https://www.imdb.com/title/tt19296606/,tvEpisode,6.0,42,2022,"Crime, Drama, Mystery, Romance",404,2022-04-17,Gabriel Correa
tt19409314,3,2022-05-01,Riverdale: Chapter One Hundred and Six: Angels in America,https://www.imdb.com/title/tt19409314/,tvEpisode,6.3,42,2022,"Crime, Drama, Mystery, Romance",458,2022-04-24,Claudia Yarmy
tt1951261,2,2021-06-16,The Hangover Part III,https://www.imdb.com/title/tt1951261/,movie,5.8,100,2013,"Comedy, Crime",321645,2013-05-20,Todd Phillips
tt1951264,4,2022-04-29,The Hunger Games: Catching Fire,https://www.imdb.com/title/tt1951264/,movie,7.5,146,2013,"Action, Adventure, Sci-Fi, Thriller",679120,2013-11-11,Francis Lawrence
tt1972591,8,2023-01-29,King Arthur: Legend of the Sword,https://www.imdb.com/title/tt1972591/,movie,6.7,126,2017,"Action, Adventure, Drama, Fantasy",222389,2017-04-27,Guy Ritchie
tt2015381,8,2022-12-25,Guardians of the Galaxy,https://www.imdb.com/title/tt2015381/,movie,8.0,121,2014,"Action, Adventure, Comedy, Sci-Fi",1198995,2014-07-21,James Gunn
tt2076822,7,2023-01-22,Chaos Walking,https://www.imdb.com/title/tt2076822/,movie,5.7,109,2021,"Action, Adventure, Fantasy, Sci-Fi, Western",51645,2021-02-24,Doug Liman
tt2109248,1,2022-09-19,Transformers: Age of Extinction,https://www.imdb.com/title/tt2109248/,movie,5.6,165,2014,"Action, Adventure, Sci-Fi",319347,2014-06-19,Michael Bay
tt21443394,4,2023-02-20,The Flash: Hear No Evil,https://www.imdb.com/title/tt21443394/,tvEpisode,5.8,,2023,"Action, Adventure, Drama, Sci-Fi",844,2023-02-15,Eric Wallace
tt21443396,2,2023-02-28,The Flash: Rogues of War,https://www.imdb.com/title/tt21443396/,tvEpisode,6.2,,2023,"Action, Adventure, Drama, Sci-Fi",808,2023-02-22,Brenton Spencer
tt21443398,4,2023-03-14,"The Flash: The Mask of the Red Death, Part 1",https://www.imdb.com/title/tt21443398/,tvEpisode,6.1,,2023,"Action, Adventure, Drama, Sci-Fi",744,2023-03-01,Menhaj Huda
tt21443400,3,2023-03-14,"The Flash: The Mask of the Red Death, Part 2",https://www.imdb.com/title/tt21443400/,tvEpisode,5.9,,2023,"Action, Adventure, Drama, Sci-Fi",693,2023-03-08,Rachel Talalay
tt21443402,2,2023-03-29,"The Flash: The Good, the Bad and the Lucky",https://www.imdb.com/title/tt21443402/,tvEpisode,3.7,,2023,"Action, Adventure, Drama, Sci-Fi",893,2023-03-15,Chad Lowe
